{
  "backends": [
    {
      "hours": 0.03,
      "jobs": 2,
      "kind": "cloud",
      "name": "cloud",
      "share": 100.0
    }
  ],
  "burn_per_day": "0.2",
  "demo": false,
  "dollars_reclaimed": "0",
  "dollars_spent": "0.05",
  "generated_at": "2026-01-15T12:00:00+00:00",
  "gpu_hours_used": "0",
  "jobs_all_time": 2,
  "members_all_time": 2,
  "members_this_week": 2,
  "month": {
    "completed": 1,
    "failed": 0,
    "interrupted": 0,
    "preempted": 0,
    "reclaimed": 0
  },
  "pilot": false,
  "pool_remaining": "491.67",
  "queue_7d": [
    null,
    null,
    null,
    null,
    null,
    null,
    null,
    null,
    null,
    null,
    null,
    null,
    null,
    null,
    null,
    null,
    null,
    null,
    null,
    null,
    null,
    null,
    null,
    null,
    null,
    null,
    null,
    null,
    null,
    null,
    null,
    null,
    null,
    null,
    null,
    null,
    null,
    null,
    null,
    null,
    null,
    null,
    null,
    null,
    null,
    null,
    null,
    null,
    null,
    null,
    null,
    null,
    null,
    null,
    null,
    0.0
  ],
  "queue_depth": 0,
  "recent": [
    {
      "gpu_type": "a10g",
      "hours": 0.03,
      "member": "user-a",
      "state": "COMPLETED",
      "utilization": 85.0,
      "where": "cloud"
    }
  ],
  "repeat_members": 0,
  "running": [
    {
      "gpu_type": "a10g",
      "hours": 0.0,
      "member": "user-b",
      "state": "RUNNING",
      "utilization": 85.0,
      "where": "cloud"
    }
  ],
  "running_now": 1,
  "runway_confident": false,
  "runway_days": 2458.35,
  "utilization_30d": [
    null,
    null,
    null,
    null,
    null,
    null,
    null,
    null,
    null,
    null,
    null,
    null,
    null,
    null,
    null,
    null,
    null,
    null,
    null,
    null,
    null,
    null,
    null,
    null,
    null,
    null,
    null,
    null,
    null,
    null,
    null,
    null,
    null,
    null,
    null,
    null,
    null,
    null,
    null,
    null,
    null,
    null,
    null,
    null,
    null,
    null,
    null,
    null,
    null,
    null,
    null,
    null,
    null,
    null,
    null,
    85.0
  ],
  "utilization_7d": [
    null,
    null,
    null,
    null,
    null,
    null,
    null,
    null,
    null,
    null,
    null,
    null,
    null,
    null,
    null,
    null,
    null,
    null,
    null,
    null,
    null,
    null,
    null,
    null,
    null,
    null,
    null,
    null,
    null,
    null,
    null,
    null,
    null,
    null,
    null,
    null,
    null,
    null,
    null,
    null,
    null,
    null,
    null,
    null,
    null,
    null,
    null,
    null,
    null,
    null,
    null,
    null,
    null,
    null,
    null,
    85.0
  ],
  "utilization_mean_30d": 85.0,
  "utilization_mean_7d": 85.0,
  "utilization_peak_7d": 85.0,
  "week": {
    "completed": 1,
    "failed": 0,
    "interrupted": 0,
    "preempted": 0,
    "reclaimed": 0
  }
}
